,Image,Category,sub-category,Tittle,Details
100,,Living,sofas,Dahlia,"Soft tan sectional sofa with plush cushioning, a built-in corner table with storage, and a classic design, offering both style and functionality for your living space."
101,,Living,sofas,Azalea,"Stylish blue sofa with a modern design and hidden storage in the chaise lounge, offering both comfort and practicality for a clutter-free living room."
102,,Living,sofas,Lotus,"Versatile grey sofa bed with a sleek design, easily converting from a comfortable sofa to a relaxing bed, perfect for small spaces and accommodating guests."
103,,Living,Sofa Cum Bed,Lychee,"Versatile green sofa with a sleek design, easily converting into a comfortable bed, offering both style and practical sleeping space for guests or relaxation."
104,,Living,Recliners ,Celosia,"Plush beige recliner offering ultimate comfort and adjustable reclining positions, perfect for unwinding, reading, or relaxing in style."
105,,Living,Recliners ,Angelica,"Modern light grey recliner with plush cushioning and an easy-to-use reclining mechanism, offering both contemporary style and comfortable relaxation for your living space."
106,,Living,Recliners ,Gentian,"Classic maroon Leatherette recliner with plush cushioning and an easy-to-use reclining mechanism, offering both traditional comfort and stylish relaxation."
107,,Living,Recliners ,Hebe,"Plush tan recliner offering exceptional comfort and versatile style, perfect for unwinding, reading, or relaxing in your preferred position."
108,,Living,Recliners ,Gladiolus,"Modern light gray recliner with plush cushioning and an easy-to-use reclining mechanism, offering both contemporary style and comfortable relaxation for your living space."
109,,Living,Recliners ,Aconite,"Modern blue-grey recliner with plush cushioning and an easy-to-use reclining mechanism, offering both contemporary style and comfortable relaxation for your living space."
110,,Living,sofas,Mangosteen,"Modern grey Leatherette sectional with adjustable headrests, plush cushioning, and a chaise lounge, offering both sophisticated style and ultimate comfort for your living space."
111,,Living,sofas,Goldenrod,"Modern grey sectional sofa with adjustable headrests, plush cushioning, and a chaise lounge, offering both contemporary style and customizable comfort for your living space."
112,,Living,Recliners ,Daphne ,"Classic brown Leatherette reclining loveseat with plush cushioning, offering both style and shared comfort for relaxing or enjoying entertainment."
113,,Living,Recliners ,Acacia,"Tan reclining loveseat with plush cushioning and a convenient center console with storage and cup holders, offering both comfort and functionality for shared relaxation."
114,,Living,Recliners ,Lilac,"Modern light grey reclining loveseat with plush cushioning and independently reclining seats, offering both contemporary style and shared comfortable relaxation for your living space."
115,,Living,Recliners ,Eremurus,"Modern brown Leatherette reclining sofa with plush cushioning, offering both contemporary style and ultimate comfort for relaxing or entertaining."
116,,Living,Recliners ,Iris,"Modern blue Leatherette reclining sofa with plush cushioning, offering both contemporary style and ultimate comfort for relaxing or entertaining."
117,,Living,Recliners ,Guzmania,"Modern light grey reclining sofa with plush cushioning, offering both contemporary style and ultimate comfort for relaxing or entertaining."
118,,Living,Recliners ,Chrysanthemum,"Modern tan reclining sectional with plush cushioning, adjustable headrests, and convenient reclining seats, offering both style and customizable comfort for ultimate relaxation."
119,,Living,Recliners ,Alchemilla,"Modern red Leatherette sectional sofa with plush cushioning, adjustable headrests, and a chaise lounge, offering both bold style and ultimate comfort for contemporary living."
120,,Living,Recliners ,Petunia,"Brown Leatherette reclining sectional with plush cushioning, cup holders, and a chaise lounge, offering both comfort and functionality for relaxing or entertaining in your living room."
121,,BedRoom,Head Boards,Agapanthus,"Elegant beige bed with a stylish channel-tufted headboard, offering both sophisticated design and comfortable support for a restful and stylish sleep."
122,,BedRoom,Head Boards,Elder,"Striking upholstered bed with a contrasting black frame, offering both a bold contemporary style and a soft, inviting comfort for a restful and elegant sleep."
123,,BedRoom,Head Boards,Columbine,"Elegant tufted daybed with a classic design, offering both stylish seating and a comfortable sleeping space for versatile functionality in any living room or guest room."
124,,BedRoom,Head Boards,Durian,"Elegant bed with a unique scalloped headboard and footboard, combining vintage charm and refined sophistication for a restful and stylish sleep."
125,,BedRoom,Head Boards,Allium,"Elegant beige upholstered bed with a gently curved, nailhead-trimmed headboard, offering both classic sophistication and comfortable support for a restful and stylish sleep."
126,,BedRoom,Head Boards,Hellebore,"Elegant bed with a sophisticated tufted headboard, offering both classic charm and comfortable support for a restful and stylish sleep."
127,,BedRoom,Head Boards,Asphodel,"Luxurious blue bed with a deep button-tufted headboard, offering both sophisticated style and comfortable support for a restful and opulent sleep."
128,,BedRoom,Head Boards,Helenium,"Stylish bed with built-in storage drawers, offering both a contemporary design and practical functionality for a clutter-free and organized bedroom."
129,,BedRoom,Head Boards,Candytuft,"Elegant bed with a sophisticated tufted headboard, offering both classic charm and comfortable support for a restful and stylish sleep."
130,,Living,chairs ,Abutilon,"Bright yellow velvet accent chair with a modern design, plush upholstery, and sleek gold-capped legs, offering both style and comfort for any living space."
131,,Living,chairs ,Erigeron,"Luxurious swivel accent chair with gold metal accents and plush upholstery, offering both unique style and comfortable functionality for any living space."
132,,Living,chairs ,Orange blossom,"Chic black and white patterned accent chair with a modern silhouette and sleek metal legs, offering both style and comfort for any living space."
133,,Living,chairs ,Mandrake,"Classic blue wingback accent chair with tufting, nailhead trim, and a high back, offering both timeless elegance and comfortable support for any living space."
134,,Living,chairs ,Liverleaf,"Chic pink velvet accent chair with a unique, shell-shaped design, plush contoured seat, and sleek gold legs, offering both glamour and comfort for any living space."
135,,Living,chairs ,Narcissus,"Bright yellow velvet accent chair and ottoman with plush upholstery and sleek metal legs, offering both style and comfort for any living space."
136,,Living,chairs ,Pansy,"Sleek and modern gray accent chair with a unique, sculptural design, offering both contemporary elegance and comfortable support for any living space."
137,,Living,chairs ,Primrose,"Bright yellow velvet accent chair with a modern design, plush upholstery, and sleek legs, offering both style and comfort for any living space."
138,,Living,chairs ,Ranunculus,"Chic pink velvet accent chair with a modern design, plush upholstery, and sleek legs, offering both style and comfortable relaxation for any living space."
139,,Living,chairs ,Snowflake,"Chic white swivel accent chair with a unique textured design, plush rounded seat, and smooth swivel base, offering both modern elegance and comfortable functionality for any living space."
140,,Dining,Dining chairs,Wild daffodil,"Modern orange and gray dining chair with a sleek design, contoured back, and padded seat, offering both style and comfort for your dining space."
141,,Dining,Dining chairs,Winter aconite,"Elegant pink velvet dining chair with a modern design, contoured back, padded seat, and gold legs, offering both style and comfort for your dining space."
142,,Dining,Dining chairs,Winter rose,"Modern gray dining chair with a sleek design and comfortable cushioning, offering both contemporary style and versatile functionality for your dining space."
143,,Dining,Dining chairs,Adonis,"Elegant red dining chair with a classic tufted back design, offering both sophistication and comfortable support for memorable meals in your dining space."
144,,Dining,Dining chairs,Amber,"Classic brown dining chair with a supportive backrest and padded seat, upholstered in a durable material, offering both comfort and versatile style for your dining space"
145,,Dining,Dining chairs,Arnica,"Classic beige dining chair with a supportive backrest, padded seat, and nailhead trim, offering both timeless style and comfortable support for your dining space."
146,,Dining,Dining chairs,Bloomfell,"Elegant yellow dining chair with a sophisticated tufted back design and classic curved legs, offering both vintage charm and comfortable support for memorable meals in your dining space."
147,,Dining,Dining chairs,Bluebell,"Modern dining chair with a unique curved back, offering both stylish support and comfortable seating, making it a versatile addition to any dining space."
148,,Dining,Dining chairs,Burnet,"Elegant grey dining chair with a sophisticated tufted back design, offering both classic charm and comfortable support for memorable meals in your dining space."
149,,Dining,Dining chairs,Chamomile,"Elegant blue dining chair with a sophisticated tufted back design and nailhead trim, offering both classic charm and comfortable support for memorable meals in your dining space."
150,,Dining,Dining chairs,Cleaver,"Modern gray upholstered dining chair with armrests, offering both style and comfortable support, making it a versatile and elegant addition to any dining room."
151,,Dining,Dining chairs,Clover,"Modern gray velvet dining chair with a sleek design, comfortable cushioning, and a supportive backrest, offering both contemporary style and luxurious comfort for your dining space."
152,,Dining,Dining chairs,Corydalis,"Modern light gray dining chair with a sleek design and comfortable cushioning, offering both contemporary style and versatile functionality for your dining space."
153,,Dining,Dining chairs,Crowflower,"Elegant blue velvet dining chair with a modern design, contoured back, padded seat, and metal legs, offering both style and comfort for your dining space."
154,,Dining,Dining chairs,Field poppy,"Modern side chair with a sleek Leatherette seat, open back, and slim metal legs, offering both contemporary style and comfortable support for your kitchen or dining area."
155,,Dining,Dining chairs,Flax ,"Modern orange dining chair with a stylish diamond-stitched back, contoured seat, and sleek metal legs, offering both contemporary elegance and comfortable support for your dining space."
156,,Dining,Dining chairs,Honeyberry,"Chic modern dining chair with a unique rounded back and contrasting upholstery, offering both contemporary elegance and comfortable support, making it a versatile addition to any dining space."
157,,Dining,Dining chairs,Horsefoot,"Modern yellow dining chair with a sleek design, a unique cutout back, a padded seat, and metal legs, offering both contemporary style and comfortable support for your dining space."
158,,Living,pouffes,Knapweed,"Chic ribbed velvet ottoman with a modern design, plush cushioned top, and sleek silhouette, offering both style and comfort for any living space."
159,,Living,pouffes,Liverwort,"Chic white textured ottoman with a modern design, plush cushioned top, and minimalist base, offering both style and comfort for any living space."
160,,Living,pouffes,Malva,"Charming floral patterned ottoman with a plush top and a sleek gold base, offering both style and comfort for any living space."
161,,Living,pouffes,Meadowfoam,"Modern gray ottoman with a plush top and subtle gold trim, offering both style and comfort for any living space."
162,,Living,pouffes,Lime,"Luxurious blue velvet ottoman with a plush top and sleek gold legs, offering both style and comfort for any living space."
163,,Living,pouffes,Gooseberry,"Chic ribbed velvet ottoman with a modern design, plush cushioned top, and sleek silhouette, offering both style and comfort for any living space."
164,,Living,pouffes,Pippau,"Modern gray ottoman with a plush top and unique textured finish, offering both style and comfort for any living space."
165,,Living,pouffes,Scabious,"Modern pink ottoman with a plush top and unique textured finish, offering both style and comfort for any living space."
166,,Living,pouffes,Smallwort,"Chic black and white patterned ottoman with a modern design, plush cushioned top, and minimalist base, offering both style and comfort for any living space."
167,,Outdoor,Outdoor dining,olive,"A stylish outdoor gazebo with a sturdy metal frame and a transparent sloped roof, featuring wooden benches and a central rectangular table. Light, sheer curtains with brown accents add elegance and a cozy ambiance to the setting"
168,,Outdoor,Outdoor dining,Thistle,"This is a round outdoor gazebo set with a vibrant green canopy, supported by intricately designed metal frames for added elegance. The set includes a circular wooden table with an orange base and matching curved benches, complemented by small potted plants for a refreshing touch. Its stylish and functional design makes it perfect for garden gatherings or patio seating."
169,,Outdoor,Outdoor dining,Vipe,"An elegant hardwood gazebo featuring a double-tiered pagoda-style roof in rich brown, complete with built-in bench seating and a charming porch swing. The structure includes decorative lattice details and climbing vines, creating a perfect blend of functionality and outdoor aesthetics."
170,,Outdoor,Outdoor dining,Woodruff,"A charming circular outdoor pavilion with a rustic thatched roof and decorative metal frames, featuring built-in seating around a central table. It creates an inviting space perfect for al fresco dining or casual gatherings."
171,,Outdoor,Outdoor dining,Yarrow,"A contemporary outdoor gazebo with a two-tiered emerald green canopy and sleek black metal posts, featuring built-in wooden bench seating around a central table. Its hexagonal design blends modern style with functional outdoor comfort."
172,,Outdoor,Outdoor dining,African Daisy,"A charming outdoor pavilion featuring a distinctive double-tiered sky blue canopy with scalloped edges, supported by durable dark metal framework and equipped with integrated bench seating; this hexagonal design creates an inviting communal space perfect for casual dining or relaxation while providing essential shade and weather protection."
173,,Outdoor,Outdoor dining,Trumpet,"An elegant outdoor shelter showcasing a rustic thatched roof design atop a sturdy metal frame, complete with built-in perimeter bench seating in classic black; this traditional-style pavilion offers a natural, resort-like atmosphere perfect for outdoor gatherings while providing a comfortable and shaded space for dining or socializing."
174,,Outdoor,Outdoor dining,Chikoo,"This modern outdoor dining set features a striking lime green finish across all pieces, including a rectangular table, matching chairs, and a coordinating bench. The all-metal construction with slatted design provides both durability and style, while potted tropical plants surrounding the setup create an inviting garden dining atmosphere perfect for outdoor entertaining."
175,,Outdoor,Outdoor dining,Bougainvillea,"This intimate conversation set combines rich brown woven wicker with plush beige cushions, featuring two comfortable armchairs and a matching cubic side table. The compact design makes it ideal for small patios or balconies, while the durable all-weather construction ensures longevity in outdoor conditions."
176,,Outdoor,Outdoor dining,Bromeliad,"This elegant outdoor dining arrangement showcases a natural beige rattan construction with a glass-topped square table and four matching chairs. The traditional woven pattern adds texture and visual interest, while the lightweight yet sturdy design offers both comfort and practicality for outdoor dining."
177,,Outdoor,Outdoor dining,Canna,"This contemporary dining set combines white aluminum frames with warm teak-style slats, creating a clean and sophisticated look. The square table and four matching chairs feature a perfect blend of materials that offer both weather resistance and classic appeal, ideal for modern outdoor spaces."
178,,Outdoor,Outdoor dining,Chenille,"This sophisticated outdoor dining set features a round glass-topped table surrounded by four coordinating chairs, all crafted in a subtle grey wicker finish. The curved design elements and woven texture create an elegant yet casual atmosphere perfect for outdoor entertaining or everyday use."
179,,Outdoor,Outdoor seating and Chairs,Clvia,"A luxurious covered jhula featuring a sturdy metal frame with an elegant taupe canopy and mesh curtains, complete with comfortable seating and a built-in table, perfect for creating a cozy outdoor relaxation spot protected from the elements."
180,,Outdoor,Outdoor seating and Chairs,Frangipani,"A classic garden jhula with a brown weather-resistant canopy, featuring beautifully woven rattan seating with plush cushions supported by a robust metal frame, designed for gentle swaying while enjoying the outdoor atmosphere."
181,,Outdoor,Outdoor seating and Chairs,Heliconia,"A spacious three-seater garden jhula with a sturdy black metal frame and curved supports, showcasing a contemporary design. It features tan cushioned individual seats for added comfort, topped with a weather-resistant brown canopy and protective side panels for outdoor relaxation."
182,,Outdoor,Outdoor seating and Chairs,Lobster,"A compact two-seater garden jhula showcasing a minimalist black metal frame with clean, modern lines and elegant curves. Features a comfortable cushioned bench seat in beige, perfect for intimate outdoor seating. Crowned with a simple yet effective beige canopy that provides essential shade while maintaining a sleek, uncluttered appearance."
183,,Outdoor,Outdoor seating and Chairs,Lotus Outdoor Seater,"A classic three-seater garden jhula design with a robust black metal frame and extended support structure. Distinguished by its plush, tufted bench-style seating in tan upholstery with decorative button details. Topped with a dark-colored structured canopy that offers superior sun protection and adds a touch of sophistication to outdoor spaces."
184,,Outdoor,Outdoor seating and Chairs,Medinille,"An elegant garden jhula with a Victorian-inspired silver frame, decorative scrollwork, and gentle curved supports. It features a plush tufted beige two-seater bench with matching cushions, topped with a scalloped tan canopy for a romantic outdoor touch."
185,,Outdoor,Outdoor seating and Chairs,Passionflower,"A modern double-seater garden jhula with innovative split-seat design featuring individual curved canopies for personalized shade. The sophisticated black frame curves gracefully to support two independent tan-colored seats, offering personal space for each user. Perfect for contemporary outdoor settings with its unique silhouette that combines functionality with artistic design elements."
186,,Outdoor,Outdoor seating and Chairs,Aster,"A timeless garden jhula design featuring a sturdy black metal frame with graceful curved supports and clean lines. The generous bench seat comes upholstered in neutral tan fabric with subtle tufting for classic appeal and optimal comfort. Crowned with a coordinating tan canopy with gentle pleats, providing essential shade while maintaining an elegant outdoor presence."
187,,Outdoor,Outdoor seating and Chairs,Aubrieta,"This modern Eames-style side chair features a light blue molded plastic seat with an ergonomic design. It sits on natural wooden legs with black metal cross-supports, blending mid-century style with contemporary simplicity, perfect for dining rooms, offices, or studios."
188,,Outdoor,Outdoor seating and Chairs,Mulberry Outdoor Seater,"This modern take on a classic Windsor chair features a sleek black spindle back for an elegant, airy look. The vertical slats add structure, while the two-tone design with natural wooden legs blends traditional and contemporary styles."
189,,Outdoor,Outdoor seating and Chairs,Begonia,"This contemporary monochromatic dining chair showcases a seamless, modern silhouette crafted entirely from durable molded plastic in a refreshing teal color. The chair's clean lines and subtle texture pattern create visual interest while maintaining a minimalist aesthetic, with an ergonomically designed seat and backrest that flow together in one continuous form. "
190,,Outdoor,Outdoor seating and Chairs,lizzie,"This sophisticated dining chair features a striking monolithic design in deep black, with a gracefully curved backrest that wraps partially around to create integrated armrests. The all-plastic construction maintains a sleek, unified appearance while providing durability and easy maintenance."
191,,Outdoor,Outdoor seating and Chairs,Fig,"This contemporary interpretation of a barrel chair combines traditional spindle-back styling with modern sensibilities, finished in a calming sage green that adds a fresh, natural touch. The chair successfully bridges classic and contemporary design elements, making it a versatile piece for both modern farmhouse and Scandinavian-inspired interiors."
192,,Outdoor,Outdoor seating and Chairs,Coneflower,"This vibrant dining chair features a playful geometric pattern in its backrest, with organic bubble-like cutouts creating a dynamic interplay of negative space. The coral-red hue makes a bold statement while the modern molded construction ensures durability and comfort."
193,,Outdoor,Outdoor seating and Chairs,Kiwi,"This statement piece combines mid-century modern influence with contemporary comfort, featuring a textured yellow shell seat with integrated armrests atop sleek black legs. The chair's honeycomb-like surface texture adds both visual and tactile interest while maintaining structural integrity. The contrasting base creates a sophisticated two-tone effect, while the curved form of the seat shell provides ergonomic support with a distinctly modern aesthetic."
194,,Outdoor,Outdoor seating and Chairs,Fuchsie,"This elegant outdoor dining chair features a sophisticated woven synthetic rattan pattern in classic black, creating a timeless yet contemporary aesthetic. The durable aluminum frame ensures weather resistance while maintaining a sleek profile, perfect for both patio and indoor-outdoor transitional spaces."
195,,Outdoor,Outdoor seating and Chairs,Avocado,"This contemporary bar stool combines a vibrant red seat with natural wooden legs, creating a striking balance between modern and Scandinavian design elements. The minimalist three-legged base provides stable support while maintaining a light visual footprint, making it an eye-catching accent piece for any modern kitchen or bar area."
196,,Outdoor,Outdoor seating and Chairs,Larkspur,"This sophisticated bar stool features a classic cane-woven backrest paired with a black frame, offering a perfect blend of traditional craftsmanship and modern design. The tall, slender silhouette is enhanced by the natural cane pattern, creating an elegant seating option that brings warmth and texture to contemporary spaces."
197,,Outdoor,Outdoor seating and Chairs,Lilacbush,"This stylish bar chair showcases a quilted cognac-colored upholstery with a distinctive diamond pattern, supported by black metal legs with eye-catching yellow accents. The comfortable curved seat and backrest combine with modern industrial elements to create a sophisticated piece that bridges casual and upscale design aesthetics."
198,,Outdoor,Outdoor seating and Chairs,Lily,"This charming rocking chair combines a soft pink quilted seat with mint green tubular metal frames, creating a delightful retro-modern aesthetic. The graceful curved runners and minimalist design make it a perfect statement piece for nurseries, living rooms, or covered porches where comfort meets contemporary style."
199,,Outdoor,Outdoor seating and Chairs,Marguerite,"This modern folding chair features a striking black and white chevron pattern woven into its durable synthetic material, creating a bold geometric statement. The sleek black metal frame offers both stability and portability, making it perfect for both indoor and outdoor gatherings while adding a contemporary touch to any space."
200,,Outdoor,Outdoor seating and Chairs,Mullein,"This bohemian-inspired rocking chair showcases a natural rope weave pattern in a warm beige tone, forming an elegant oval cocoon shape supported by a black metal frame. The modern interpretation of the classic Acapulco design combines comfort with style, featuring smooth rocking runners that make it an ideal piece for both indoor lounging and covered outdoor spaces."
201,,Outdoor,Outdoor seating and Chairs,Peony,This sophisticated dining chair combines olive green Leatherette upholstery with warm wooden arms and legs in a classic mid-century modern design. The thoughtful combination of materials and angular construction creates a comfortable yet stylish seating option that pays homage to vintage furniture while maintaining contemporary appeal.
202,,Outdoor,Outdoor seating and Chairs,Sweet alison,"This contemporary dining chair features a seamless coral-colored molded plastic construction with smooth, organic curves throughout its design. The monochromatic piece offers a minimalist yet playful approach to modern seating, with an ergonomic backrest that provides both comfort and style for everyday use."
