,Image,Category,sub-category,Tittle,Details
1,,Dining,Dining Table,Rupestre,"This is a six-seater wooden dining table set, crafted from solid wood with a polished finish that highlights the natural grain patterns of the wood. The set includes a rectangular table and six matching chairs, each featuring a sturdy backrest with a rectangular cutout for added design and support. The style is modern yet classic, making it ideal for dining rooms with contemporary or traditional decor."
2,,Dining,Dining Table,Anemone,"This is a four-seater wooden dining table set, designed with a minimalist and modern aesthetic. The table has a square shape with clean, sturdy legs, while the chairs feature comfortable armrests and a slatted back design, complemented by cushioned seats for added comfort. The natural wood finish enhances its timeless appeal, making it ideal for compact dining spaces or outdoor settings."
3,,Dining,Dining Table,Primula ,"Bennova is a modern 6-seater dining set featuring a rectangular table, four cushioned chairs, and a matching bench. Crafted from premium wood with a rich natural finish, it combines comfort and style, making it ideal for both family meals and gatherings."
4,,Dining,Dining Table,Helodes,"A sleek and durable wooden dining set featuring a rectangular table and four matching chairs with slatted backrests. Designed with a rich brown finish, this set is perfect for modern and traditional dining spaces."
5,,Dining,Dining Table,Snowbell,"A stylish six-seater dining set featuring a smooth wooden table with rounded edges and six cushioned chairs with fabric upholstery. The light wood finish and minimalist design make it a perfect choice for contemporary dining spaces."
6,,Dining,Dining Table,Cowslip,"A sleek and modern four-seater dining set featuring a smooth wooden table with a stylish geometric base and ergonomically designed chairs with cushioned seats and wooden armrests. Perfect for contemporary dining spaces."
7,,Dining,Dining Table,Sunflower,"A stylish square dining set with a smooth tabletop and four cushioned chairs that tuck in neatly. The grey upholstered chairs provide comfort and elegance, complementing modern interiors. Ideal for compact spaces, offering both functionality and aesthetic appeal."
8,,Dining,Dining Table,"
Millennial","A sophisticated rectangular dining table with a sleek dark surface, complemented by four stylish grey upholstered chairs. The chairs feature a contemporary wooden frame design, blending comfort and aesthetics. Perfect for upscale dining spaces with a modern touch."
9,,Dining,Dining Table,Florulenta,"A stunning rectangular dining table with a marble-finish top and elegant gold accents. Paired with six quilted two-tone chairs in rich brown and cream, offering both style and comfort. Perfect for adding a touch of sophistication to any dining space."
10,,Dining,Dining Table,Peony Italian,"A timeless rectangular dining table with a clear glass top over a beautifully carved wooden frame. Paired with six elegantly upholstered chairs featuring intricate wood detailing and soft grey cushions. Perfect for adding a touch of vintage charm to any dining space."
11,,Dining,Dining Table,Arum Lilies,"A luxurious round dining table with a marble top and a rotating centerpiece for convenience. Paired with four high-back tufted chairs upholstered in rich beige fabric with wooden accents. Perfect for adding sophistication and functionality to any dining area."
12,,Study,Study Table,"Plumeria
","This is a Lockies Sheesham wood study table featuring a natural wood finish, a spacious rectangular top, and a two-drawer storage unit with intricate Jali work detailing. It offers a blend of functionality and traditional aesthetics for a study or home office space."
13,,BedRoom,Bed Cots,Elisabethae,"This is a wooden platform bed with a minimalist design, featuring a low-profile rectangular headboard and a matching side table. The bed is dark-finished and includes a light-colored mattress with a striped blanket, complemented by a neutral-toned rug."
14,,BedRoom,Bed Cots,Florescence,"This is a dark wood panel bed featuring an oversized, multi-tiered headboard with open shelving on the sides and a two-tone design. The accompanying bedroom furniture includes a matching wardrobe and a small side table, enhancing the room's storage and functionality."
15,,BedRoom,Bed Cots,Jonopsidium savianum,"This is a dark wood storage bed with a panel headboard featuring built-in shelving units on each side, offering convenient bedside storage. The room also includes a matching tall bookshelf with open shelving, enhancing the functionality and storage capacity of the space."
16,,BedRoom,Bed Cots,Petals,"This is a dark wood panel bed with a beige cushioned headboard featuring tufting details and built-in shelving on the sides. The room also showcases a matching wardrobe with sliding doors in a combination of dark wood and beige panels, creating a cohesive look."
17,,BedRoom,Bed Cots,Stigma,"This is a dark wood, low-profile platform bed with a paneled headboard featuring metallic horizontal stripes, creating a modern, minimalist design. The room also includes a matching two-tone wardrobe with contrasting white doors, enhancing storage and style."
18,,BedRoom,Bed Cots,Orchid,"This is a modern platform bed with a two-tone, white and wood headboard featuring built-in side tables and a low-profile, dark wood frame. The room also includes a matching wardrobe with contrasting white doors, complementing the bed's aesthetic."
19,,BedRoom,Bed Cots,Rose,"This is a dark wood platform bed with a white, cushioned headboard featuring patterned, wood-trimmed side panels. The room includes matching bedside tables and is decorated with two framed abstract art pieces, enhancing the modern design."
20,,BedRoom,Bed Cots,Violet,"This is a dark wood, single-sized bed featuring a panel headboard with built-in shelving, ideal for storage and display. The room is decorated with a round jute rug, a small side table with a vase, and a framed abstract art piece, creating a cozy and organized space."
21,,BedRoom,Bed Room Tables,Gilly,"This is a modern bedside table with a two-tone design, featuring a dark wood frame and a contrasting white drawer with a silver knob. It offers both closed storage in the drawer and open storage below, and is topped with a neutral-toned lamp."
22,,BedRoom,Bed Room Tables,Daisy,"This is a modern bedside table with a two-tone design, featuring a dark wood frame and a contrasting white drawer with a silver knob. It offers both closed storage in the drawer and open storage below, and is topped with a neutral-toned lamp."
23,,BedRoom,Bed Room Tables,Cyclamen,"This is a modern bedside table with a two-tone design, featuring a dark wood frame and a contrasting white drawer with a silver knob. It offers both closed storage in the drawer and open storage below, and is topped with a neutral-toned lamp."
24,,Storage,Wardrobes,Hortensia,"This is a dark wood wardrobe with sliding doors, featuring a combination of open shelving and closed compartments for organized storage. The wardrobe includes hanging rods, stacked shelves with colorful piles of clothing, and a small lockable drawer."
25,,Storage,Wardrobes,Heather,"This is a modern, dark wood wardrobe with three doors, featuring a contrasting white center panel and sleek silver handles. It offers ample storage and includes a small framed picture, a potted plant, and a woven basket nearby, suggesting a well-organized space."
26,,Storage,Wardrobes,Lavender,"This is a tall, narrow, two-door wardrobe with a dark wood finish and simple silver handles, offering a classic design for bedroom storage. It's positioned next to a smaller shelving unit and a framed picture, suggesting a coordinated and functional bedroom setup."
27,,Storage,Wardrobes,Edelweiss,"This is a traditional, dark wood, three-door wardrobe with simple silver handles, offering ample storage for a bedroom. The wardrobe features a classic design with a top panel and is positioned in a room with a light-colored wall and a hanging plant, suggesting a neat and organized space."
28,,Storage,Wardrobes,Wisteria,"This is a modern two-door wardrobe featuring a dark wood frame contrasting with white panels, providing a clean, contemporary look. It offers closed storage and is complemented by framed artwork, a potted plant, and hanging clothes nearby, suggesting a well-organized and stylish space."
29,,Storage,Wardrobes,Cornflower,"This is a two-tone wardrobe with a dark wood frame and contrasting white doors, featuring a large circular knob on one door and a smaller knob on the other. It offers a blend of modern design and functionality, suitable for a contemporary bedroom."
30,,living,Coffee Tables,Poppy,"This is a modern, two-tiered coffee table with a unique asymmetrical design, featuring a dark wood finish and contrasting white surfaces. It offers both open display space and storage, with a lower shelf for books or decor, ideal for a contemporary living room."
31,,living,Coffee Tables,Marigold,"This is a rectangular coffee table with a dark wood finish and a contrasting white, recessed tabletop surface, offering a modern and functional design. It features an open shelf below for storage or display, complemented by a patterned rug and a grey sofa in the background."
32,,living,Coffee Tables,Hyacinth,"This is a dark wood, rectangular coffee table with a classic design, featuring a slightly raised top and multiple tiers of shelving below. The open shelves offer ample space for storage or display, making it a functional centerpiece for a living room."
33,,living,Coffee Tables,Hibiscus,"This is a modern, two-tiered coffee table featuring a dark wood finish and a contrasting white surface on the lower level, offering a contemporary look and practical storage solutions with its open shelf design. It is styled with decorative items such as magazines, a small plant, and remote controls, suggesting a functional and organized living space."
34,,Storage,Book Shelves,Rhododendron,"This is a tall, five-tiered corner bookshelf with a dark wood finish, designed to fit snugly into a room's corner, maximizing space utilization. The shelves are progressively smaller from bottom to top, offering a visually appealing display for books, decorative items, and plants."
35,,Storage,Book Shelves,Geranium,"This is a tall, rotating bookshelf with a dark wood finish, featuring multiple narrow shelves ideal for storing and displaying books or other items in a compact space. Its rotating design allows easy access to all sides and maximizes storage in a minimal footprint."
36,,BedRoom,Head Boards,Hawthorn,"This is a contemporary bed with a low-profile, dark-finished frame and a tufted, light gray headboard. The clean lines and neutral tones offer a modern aesthetic suitable for various bedroom styles."
37,,BedRoom,Head Boards,Carnation,"This is a modern platform bed featuring a dark-brown, paneled headboard with built-in shelving on the sides. The warm color and functional design offer a blend of style and practicality, perfect for a contemporary bedroom."
38,,BedRoom,Head Boards,Crocus,"This is a modern platform bed with a low-profile, dark-finished frame and a rectangular, gray fabric headboard featuring panel stitching. The clean lines and neutral tones offer a contemporary style suitable for a variety of bedroom decors."
39,,BedRoom,Bed Cots,Mulberry,"This is a modern, dark-finished platform bed featuring a paneled headboard with square cut-out details. The low-profile design and clean lines offer a contemporary aesthetic suitable for a variety of bedroom styles."
40,,BedRoom,Bed Cots,Valerian,"This is a classic, wood-framed bed with a rectangular headboard featuring simple, recessed paneling. The warm, medium-toned wood finish and traditional design offer a timeless aesthetic suitable for a variety of bedroom styles."
41,,BedRoom,Bed Cots,Daisy,"This is a modern, dark wood bed with a paneled headboard and matching footboard, both featuring square cut-out details. The rich, dark finish and contemporary design create a stylish focal point for a well-coordinated bedroom."
42,,BedRoom,Bed Cots,Agatea,"This is a contemporary, dark wood bed with a low-profile platform and a geometrically paneled headboard and footboard. The rich, dark finish and modern design offer a stylish and cohesive look for a modern bedroom."
43,,BedRoom,Bed Cots,Ivy,"This is a modern, dark wood bed with a prominent, geometrically paneled headboard and matching footboard, creating a cohesive, contemporary look. The rich wood finish and clean lines offer a stylish focal point for a well-coordinated bedroom."
44,,BedRoom,Bed Cots,Periwinkle,"This is a modern, dark wood storage bed featuring a padded, diamond-tufted headboard in a deep burgundy or mauve hue. The rich wood grain and functional design offer both style and practicality for a contemporary bedroom."
45,,BedRoom,Bed Cots,Honeysuckle,"This is a classic, dark wood bed frame featuring a simple, slatted headboard and a low-profile design. The warm, rich wood finish and timeless style offer a versatile aesthetic suitable for a variety of bedroom decors."
46,,BedRoom,Bed Room Tables,Verbena,"This is a dark wood, two-tiered side table featuring a small drawer and an open shelf, showcasing a collection of books and decorative items. The rich wood finish and functional design offer a classic accent suitable for a variety of interior styles."
47,,BedRoom,Bed Room Tables,Love-in-a-mist,"This is a dark wood, two-tiered side table featuring a small drawer and an open shelf, displaying books and topped with a modern lamp. The rich wood finish and functional design offer a classic accent suitable for a variety of interior styles."
48,,Storage,Wardrobes,Dandelion,"This is a tall, dark-finished wardrobe with a simple, utilitarian design, featuring two doors and a small ventilation grille at the top. Its minimalist aesthetic and functionality make it suitable for a variety of spaces, especially where storage is needed."
49,,Storage,Wardrobes,Pollen,"This is a classic, dark wood three-door wardrobe featuring a traditional design with panel detailing and a decorative top trim. The ample storage space and elegant styling make it a functional and attractive addition to a bedroom."
50,,Storage,Dressing Table,Xylem,"This is a contemporary, dark-finished dressing table with a tall, rectangular mirror and built-in shelving on one side. The clean lines and minimalist design offer a modern aesthetic suitable for a variety of bedroom styles."
51,,Storage,Dressing Table,Lantana,"This is a sleek, modern dressing table in a dark finish, featuring a tall rectangular mirror and built-in shelving on the side for storage. The minimalist design and clean lines make it a functional and stylish addition to a contemporary space."
52,,Living,Sofa Cum Bed,Snowdrop,"This is a contemporary sofa cum bed featuring a dark-finished base and a light-colored, cushioned top that can be easily converted into a bed. The clean lines and bi-tone design offer a modern aesthetic suitable for multi-functional spaces."
53,,Living,Coffee Tables,Rapunculus,"This is a modern, dark wood coffee table featuring a rectangular glass top and a lower shelf for storage or display. The clean lines and mixed materials offer a contemporary aesthetic suitable for a variety of living room styles."
54,,Living,Coffee Tables,Hollyhocks,"This is a modern, dark wood coffee table featuring a rectangular glass top and a lower shelf for storage or display. The clean lines and mixed materials offer a contemporary aesthetic suitable for a variety of living room styles."
55,,Living,Sofa Cum Bed,Sansevieria,"This is a contemporary sofa cum bed featuring a dark-finished base and a light-colored, cushioned top that can be easily converted into a bed. The clean lines and bi-tone design offer a modern aesthetic suitable for multi-functional spaces."
56,,Storage,Book Shelves,Saffron ,"This is a modern, asymmetrical bookshelf crafted from warm-toned wood, featuring a unique, staggered design with open cubby-like shelves. The varying shelf heights and depths offer versatile storage and display options for books, decorative objects, and plants."
57,,Storage,Book Shelves,Snapdragon,"This is a tall, dark-finished bookcase featuring a combination of open shelving with glass doors on the top section and closed storage with solid doors below. The design offers a mix of display space and concealed storage, making it a functional and stylish piece for a variety of rooms."
58,,Storage,Book Shelves,Buttercup,"This is a tall, dark-finished bookcase featuring three glass-paneled doors on the upper section, revealing multiple shelves, and three solid doors with drawers below. The combination of open display space and closed storage makes it a versatile and elegant piece for a variety of rooms."
59,,Office,Work Station Tables,Crown ,"This is a simple, dark-finished work table featuring a rectangular top, a small side drawer, and an open leg design. The minimalist aesthetic and compact size make it suitable for a variety of spaces, especially home offices or study areas."
60,,Office,Work Station Tables,Pimpernel,"This is a dark wood work table featuring a spacious rectangular top, a small side drawer, and an attached cabinet with a door and key lock. The functional design and ample storage make it suitable for a home office or study area."
61,,Office,Work Station Tables,Basil,"This is a compact, dark wood work table featuring a simple rectangular surface, a small drawer, and an open compartment below. Its minimalist design and modest size make it ideal for small spaces or as a secondary work surface."
62,,Office,Work Station Tables,Bumblebee orchid,"This is a dark-finished rectangular work table featuring a simple design with straight legs, a spacious top, and a small cabinet with a door on one side. The clean lines and functional storage make it suitable for a variety of home office or study spaces."
63,,Office,Work Station Tables,Madder,"This is a dark wood work table featuring an elevated, hutch-like design with open shelving and a spacious work surface, accompanied by a matching tall, closed-door cabinet for added storage. The combination of display space and concealed storage makes it a functional and stylish option for a home office or study."
64,,Study,Study Table,Chocolate cosmos,"This is a modern study table featuring a two-tone design with a dark-finished top and white drawers, offering a visually appealing contrast. The compact size and functional design with drawers make it suitable for smaller spaces or as a secondary work surface."
65,,Study,Study Table,Datura,"This is a dark wood study table featuring an elevated hutch-like design with open shelving and a spacious work surface, accompanied by a matching tall, closed-door cabinet for added storage. The combination of display space and concealed storage makes it a functional and stylish option for a home office or study."
66,,Study,Study Table,Flamingo,"This is a modern study table featuring a two-tone design with a dark wood top and a contrasting white, open shelving unit on one side. The compact size and functional design make it suitable for smaller spaces or as a secondary work surface."
67,,Storage,Tv Units,Kangaroo,"This is a modern, low-profile TV unit featuring a two-tone design with a dark wood main body and contrasting white accents. The unit offers a mix of open shelving and closed storage, along with a spacious top suitable for a large television."
68,,Storage,Tv Units,Parrot flower,"This is a modern, asymmetrical TV unit featuring a dark wood finish and contrasting white accents, with open shelving for media devices and decorative items. The low-profile design and unique shape offer a contemporary look suitable for a variety of living room styles."
69,,Storage,Tv Units,Lisianthus,"This is a modern entertainment center featuring a dark wood finish with contrasting white drawer fronts and a tall, asymmetrical shelving unit on one side. The combination of closed storage, open shelving, and display space makes it a functional and stylish focal point for a living room."
70,,Storage,Shoe Rack,Uniflora,"This is a compact, two-tone shoe rack featuring a dark wood finish and a contrasting white drawer on top, with a small cabinet below offering tiered storage for footwear. The functional design and modest size make it suitable for entryways or small spaces."
71,,Storage,Shoe Rack,Venus,This is a dark wood shoe rack featuring open shelving on the top tier for easy access and a closed cabinet below with double doors for concealed storage. The combination of open and closed storage solutions offers both convenience and a tidy appearance.
72,,Storage,Shoe Rack,Umbrella,"This is a modern shoe rack bench featuring a two-tone design with a dark wood base, a white cabinet door, and a cushioned seat on top. The combination of closed storage and a comfortable seating area makes it a functional and stylish addition to an entryway or mudroom."
73,,Living,sofas,Adonis,"Sleek, modern two-seater loveseat in soft light grey fabric with unique armrests and contrasting piping. Compact and comfortable, perfect for smaller spaces seeking contemporary style."
74,,Living,sofas,Daffodil,"Stylish mid-century modern blue sofa with tufted cushions and patterned pillows, offering both comfort and a vibrant pop of color to your living space."
75,,Living,sofas,Water lily,"Cheerful mustard yellow loveseat with a modern design, offering both style and comfort with plush cushions and a cozy two-seater size"
76,,Living,sofas,Jasmine,"Vibrant turquoise loveseat with plush cushions and colorful patterned pillows, offering both modern style and comfortable relaxation."
77,,Living,sofas,Amaranthus,"Versatile light grey sofa with plush cushions and button-tufting, offering both comfortable seating and a clean, modern design for any living room."
78,,Living,sofas,Magnolia,"Modern blue-grey sofa with plush cushions, matching pillows, and light wood legs, offering both style and comfort for contemporary living."
79,,Living,sofas,Tulip,"Glamorous, shell-backed dusty rose velvet loveseat with elegant gold legs, offering both luxurious comfort and a touch of vintage Hollywood style."
80,,Living,sofas,Bethlehem,"Elegant, channel-tufted beige loveseat with clean lines and plush cushions, offering both sophisticated style and comfortable seating for modern living."
81,,Living,sofas,laceleaf,"Sculptural, modern green loveseat/chair with a unique organic form and textured upholstery, offering both artistic flair and comfortable style."
82,,Living,sofas,Alyssum,"Luxurious beige sofa with elegant gold accents, plush cushions, and detailed quilting, offering both opulent style and comfortable relaxation."
83,,Living,sofas,Mimosa,"Chic mustard yellow sofa with plush cushions and sleek metal legs, offering both vibrant contemporary style and comfortable relaxation."
84,,Living,sofas,Valley,"Elegant dark grey sofa with classic button-tufting, plush cushions, decorative pillows, and a warm wood base, offering both timeless style and luxurious comfort."
85,,Living,sofas,Mallow,"Luxurious blue velvet loveseat with classic button-tufting and elegant gold legs, offering both glamorous style and sumptuous comfort."
86,,Living,sofas,Acropolis,"Elegant light grey sofa with channel tufting, gold trim, and stylish accent pillows, offering both sophisticated glamour and modern comfort."
87,,Living,sofas,Foxglove,"Plush beige sofa with stylish accent pillows, offering both comfort and a versatile design that complements any living space."
88,,Living,sofas,Camellia,"Classic brown Leatherette loveseat with plush cushions and a timeless design, offering both warmth, sophistication, and comfortable support for any living space."
89,,Living,sofas,Fuchsia,"Sleek white Leatherette loveseat with plush cushioning and a modern design, offering both contemporary elegance and comfortable support for any living space."
90,,Living,sofas,Speedwell,"Elegant, deep blue Leatherette Chesterfield sofa with button-tufting and rolled arms, offering both timeless sophistication and luxurious comfort."
91,,Living,sofas,Apple blossom,"Luxurious beige sofa with elegant button-tufting, gold accents, and plush decorative pillows, offering both opulent style and comfortable relaxation"
92,,Living,sofas,Eschscholzia,"Modern olive green loveseat with stylish channel tufting, curved armrests with metal details, and plush cushions, offering both contemporary elegance and comfortable relaxation."
93,,Living,sofas,Freesia,"Classic brown sofa with plush cushions, supportive armrests, and stylish throw pillows, offering both timeless style and comfortable relaxation for any living room."
94,,Living,sofas,Amaryllis,"Modern teal Leatherette reclining sofa with a chaise lounge and adjustable headrests, offering both style and ultimate comfort for contemporary living."
95,,Living,sofas,Forsythia,"Modern light blue Leatherette reclining sofa with adjustable headrests and a chaise lounge, offering both style and ultimate comfort for contemporary living."
96,,Living,sofas,Christmas holly,"Modern beige reclining sofa with adjustable headrests and a chaise, offering both sleek contemporary style and ultimate relaxation for your living space."
97,,Living,sofas,Mistletoe,"Modern light blue sectional sofa with a chaise lounge and plush cushions, offering both style and customizable comfort for a relaxing and stylish living space."
98,,Living,sofas,Aloe,"Modern blue sectional sofa with adjustable headrests and a modular design, offering both sophisticated style and customizable comfort for your living space."
99,,Living,sofas,,"Rich brown Leatherette sectional sofa with plush cushioning, a built-in corner table, and a classic design, offering both style and functionality for your living space."
