,Image,Category,sub-category,Tittle,Details
,,Bedroom, Bunker Beds,Belladonna Lily,"   A charming white wooden bunk bed with built-in stairs, extra storage, and a spacious lower bed, perfect for comfort and convenience.
"
,,Bedroom, Bunker Beds,Satin Flower,"A sleek, modern grey bunk bed with built-in shelves and glow-in-the-dark staircase steps, offering functionality, safety, and a contemporary aesthetic."
,,Bedroom, Bunker Beds,Angelonia,"Wooden bunk bed with a natural finish, sturdy ladder, and cozy design, perfect for maximizing space in kids' bedrooms."
,,Bedroom, Bunker Beds,Kalanchoe,"Stylish gray bunk bed with a twin-over-full design, built-in ladder, and attached desk, perfect for modern and functional spaces."
,,Bedroom, Bunker Beds,Pincushion,"Charming white bunk bed with a twin-over-full design, sturdy staircase, and cozy style, perfect for kids' bedrooms or shared spaces."
,,Office,Office Boss Chairs ,Stephanotis,"Ergonomic office chair with a breathable mesh back, cushioned seat, adjustable height, and smooth-rolling wheels for optimal comfort."
,,Office,Office Boss Chairs ,Watsonia,"Ergonomic office chair with a breathable mesh back, cushioned seat, adjustable height, and smooth-rolling wheels for optimal comfort."
,,Office,Office Boss Chairs ,Baneberry,"Ergonomic office chair with a breathable mesh back, cushioned seat, adjustable height, and smooth-rolling wheels for optimal comfort."
,,Office,Office Boss Chairs ,Corncockle,"Modern black ergonomic office chair with breathable mesh backrest, headrest support, adjustable armrests, and a sleek chrome swivel base."
,,Office,Office Boss Chairs ,Scarlet Sage,"Sleek black and red gaming chair with ergonomic design, lumbar support, adjustable armrests, recline feature, and a sturdy swivel base."
,,Office,Office Boss Chairs ,Twinspur,"Compact charcoal office chair with adjustable height, ergonomic backrest, dual lever controls, cushioned seat, and a durable five-star base.
Sleek black and red gaming chair with ergonomic design, lumbar support, adjustable armrests, recline feature, and a sturdy swivel base."
,,Office,Office Boss Chairs ,Marshmallow,"Sleek black ergonomic office chair with breathable mesh backrest, adjustable headrest, foldable armrests, padded seat, and sturdy wheelbase."
,,Office,Office Boss Chairs ,Woolflower,"Stylish ergonomic mesh office chair featuring breathable backrest, padded seat, adjustable height, sturdy metal base, and smooth-rolling casters.
"
,,Office,Office Boss Chairs ,Bearberry,"Elegant tan Leatherette swivel chair with ribbed design, padded armrests, sleek chrome base, perfect for modern offices or studies."
,,Office,Office Boss Chairs ,Bellwort,"Luxurious high-back executive chair with plush padding, ergonomic design, chrome accents, adjustable height, and smooth-rolling casters for comfort."
,,Office,Office Waiting Chairs,Trillium,"Durable three-seater metal bench with perforated backrest, ergonomic armrests, and sturdy legs, ideal for waiting areas or offices.
"
,,Office,Office Waiting Chairs,Alpine,"Sleek black visitor chair with padded seat, stitched detailing, chrome legs, and sturdy armrests, perfect for office or reception use."
,,Office,Office Waiting Chairs,Fernleaf,"Set of two sleek black office guest chairs with padded seats, durable metal frames, ergonomic armrests, and modern design."
,,Office,Office Waiting Chairs,Turtlehead,"Elegant office waiting room seating set with wooden frames, red cushioned seats, ergonomic armrests, and integrated table for convenience."
,,Office,Office Waiting Chairs,Cinquefoil,"Sleek black Leatherette office chairs with a boxy design, cushioned seats, sturdy metal legs, and minimalist style for modern spaces.
"
,,Office,Office Waiting Chairs,Fumewort,"Modern three-seater metal bench with sleek silver frame, black cushioned seats, ergonomic armrests, and durable design for office spaces."
,,Office,Office Waiting Chairs,Celandine,"Contemporary three-seater bench with lime green ribbed cushions, sleek chrome armrests, and a sturdy black metal frame for modern offices."
,,Office,Office Waiting Chairs,Dutch Iris,"Stylish waiting room set with brown cushioned chairs, sleek metal frames, wooden armrests, and a matching wooden coffee table."
,,Office,Office Waiting Chairs,Navelwort,"Stylish waiting room set with brown cushioned chairs, sleek metal frames, wooden armrests, and a matching wooden coffee table."
,,Office,Office Waiting Chairs,Coral Vine,"Modern waiting room with teal upholstered chairs featuring black metal frames, a minimalist black side table, and a light gray rug."
,,Outdoor,"Sun Loungers
",Red Valerian,"Comfortable folding lounge chair featuring a black and white houndstooth-patterned cushion, sturdy black metal frame, and adjustable backrest."
,,Outdoor,"Sun Loungers
","Sorrel
","Elegant wooden outdoor lounge chairs with beige cushions, set on a patio beside a lawn, perfect for relaxation and sunbathing."
,,Outdoor,"Sun Loungers
",Partridge Berry,"Modern adjustable sunlounger with a sleek black frame and comfortable dark gray cushion, ideal for poolside relaxation or outdoor lounging."
,,Outdoor,"Sun Loungers
",Scarlet Rosemallow,"Luxurious padded Sunlounger with adjustable backrest, armrests, and headrest, offering maximum comfort and ergonomic support for relaxation."
,,Outdoor,"Sun Loungers
","Bergenia
"," Stylish wooden sun lounger with curved ergonomic design, soft cushions, and natural aesthetics, perfect for relaxing indoors or outdoors."
,,Outdoor,"Sun Loungers
",Pine Lily,"Sleek, modern pool lounger with a curved metal frame, breathable mesh seat, and ergonomic design for ultimate relaxation by the water."
,,Outdoor,"Sun Loungers
",Velvetleaf,"Modern sun lounger with sleek black frame, weather-resistant cushions, adjustable recline, and minimalist design, perfect for poolside relaxation."
,,Outdoor,"Sun Loungers
",Camphorweed,"Lightweight lounger with bold yellow stripes, foldable design, adjustable shade canopy, and durable frame, ideal for beach relaxation."
,,Outdoor,"Sun Loungers
",Bluebeard," Ornate metal-framed lounge chair with plush cushions, striped accent pillows, rolling wheels, and classic scalloped design, perfect for outdoor relaxation."
,,Outdoor,"Sun Loungers
",Cassia," Ornate metal-framed lounge chair with plush cushions, striped accent pillows, rolling wheels, and classic scalloped design, perfect for outdoor relaxation."
,,Office,Cabin Tables ,Anigozanthos,"Spacious L-shaped desk with wood finish, built-in drawers, open shelves, and modern design, perfect for professional workspaces and organization."
,,Office,Cabin Tables ,Oncidium,"Sleek executive desk with a white top, wooden accents, integrated storage, cable management, and a minimalist, professional design."
,,Office,Cabin Tables ,Grecian Rose,"Elegant L-shaped workstation with a modern grey finish, ergonomic chairs, wall shelving, and integrated storage for a professional setup."
,,Office,Cabin Tables ,Berlandiera,"Sleek executive desk with walnut wood finish, white drawers, ergonomic chair, and panoramic views, perfect for modern workspaces."
,,Office,Cabin Tables ,Oxlip,"Contemporary walnut-finished desk with black metal legs, ergonomic mesh chair, attached storage, and clean design for stylish workspaces.
"
,,Office,Cabin Tables ,Coralberry,"Minimalistic wooden desk with a sturdy metal frame, rolling casters, perforated privacy panel, and versatile design for small spaces."
,,Office,Cabin Tables ,Zephyranthes,"Sleek wooden office desk with metal legs, spacious surface, modesty panel, and ergonomic design for professional workspaces."
,,Office,Cabin Tables ,Cardamine,"Ergonomic height-adjustable desk with sleek design, sturdy metal frame, spacious tabletop, perfect for both sitting and standing work."
,,Office,Cabin Tables ,Creeper,"Luxurious executive desk with contemporary design, premium wood finish, built-in storage, spacious surface, perfect for professional offices."
,,Office,Cabin Tables ,Uvularia,"Sophisticated L-shaped desk with wood finish, sturdy metal frame, spacious design, built-in storage, perfect for modern offices."
,,Mattress,King Size ,Leptospermum,"king size Premium Bonnell spring mattress offering superior comfort, durability, and support, with an elegant quilted design for a restful sleep."
,,Mattress,King Size ,Wood Betony,"King-size mattress with premium comfort, durable construction, breathable fabric, orthopedic support, and a luxurious sleep experience for ultimate relaxation."
,,Mattress,King Size ,Balsam,"King-size PU foam mattress offering superior comfort, durable design, excellent back support, pressure relief, breathable fabric, and a restful sleep experience."
,,Mattress,King Size ,Justicia,"King-size memory foam mattress with ergonomic support, pressure relief, motion isolation, breathable fabric, durable construction, and a luxurious sleep experience."
,,Mattress,King Size ,Plumbago,"King-size foam mattress with superior comfort, durable design, breathable fabric, orthopedic support, pressure relief, motion isolation, and a restful sleep experience.
"
,,Mattress,King Size ,Crinum Lily,"King-size cooling mattress with breathable fabric, advanced temperature regulation, pressure relief, motion isolation, ergonomic support, and a luxurious sleep experience."
,,Mattress,King Size ,Tasselflower,"King-size hybrid mattress with memory foam and pocket springs, offering superior comfort, pressure relief, motion isolation, breathability, and ergonomic support for restful sleep."
,,Mattress,King Size ,Cestrum,"King-size latex mattress with natural breathability, hypoallergenic properties, ergonomic support, pressure relief, motion isolation, and long-lasting durability for a restful sleep.
"
,,Mattress,King Size ,Jacobinia,"King-size polyfoam mattress with durable support, pressure relief, breathable fabric, motion isolation, lightweight design, and enhanced comfort for a restful sleep."
,,Mattress,King Size ,Melastoma,"King-size coil and spring mattress with excellent support, motion isolation, breathable fabric, pressure relief, durable construction, and enhanced comfort for restful sleep.
"
,,Mattress,Queen Size ,Barleria,"Queen Size  Premium Bonnell spring mattress offering superior comfort, durability, and support, with an elegant quilted design for a restful sleep."
,,Mattress,Queen Size ,"Galphimia
","Queen Size  mattress with premium comfort, durable construction, breathable fabric, orthopedic support, and a luxurious sleep experience for ultimate relaxation."
,,Mattress,Queen Size ,Sideritis,"Queen Size  PU foam mattress offering superior comfort, durable design, excellent back support, pressure relief, breathable fabric, and a restful sleep experience."
,,Mattress,Queen Size ,Indigofera,"Queen Size  memory foam mattress with ergonomic support, pressure relief, motion isolation, breathable fabric, durable construction, and a luxurious sleep experience."
,,Mattress,Queen Size ,Eustoma,"Queen Size  foam mattress with superior comfort, durable design, breathable fabric, orthopedic support, pressure relief, motion isolation, and a restful sleep experience.
"
,,Mattress,Queen Size ,Isotoma,"Queen Size  cooling mattress with breathable fabric, advanced temperature regulation, pressure relief, motion isolation, ergonomic support, and a luxurious sleep experience."
,,Mattress,Queen Size ,Melaleuca,"Queen Size  hybrid mattress with memory foam and pocket springs, offering superior comfort, pressure relief, motion isolation, breathability, and ergonomic support for restful sleep."
,,Mattress,Queen Size ,Salpiglossis,"Queen Size  latex mattress with natural breathability, hypoallergenic properties, ergonomic support, pressure relief, motion isolation, and long-lasting durability for a restful sleep.
"
,,Mattress,Queen Size ,Browallia,"Queen Size  polyfoam mattress with durable support, pressure relief, breathable fabric, motion isolation, lightweight design, and enhanced comfort for a restful sleep."
,,Mattress,Queen Size ,Clarkia,"Queen Size  coil and spring mattress with excellent support, motion isolation, breathable fabric, pressure relief, durable construction, and enhanced comfort for restful sleep.
"
,,Mattress,Single Bed ,Streptocarpus,"Single Bed  Premium Bonnell spring mattress offering superior comfort, durability, and support, with an elegant quilted design for a restful sleep."
,,Mattress,Single Bed ,Amsonia,"Single Bed  mattress with premium comfort, durable construction, breathable fabric, orthopedic support, and a luxurious sleep experience for ultimate relaxation."
,,Mattress,Single Bed ,Petasites,"Single Bed  PU foam mattress offering superior comfort, durable design, excellent back support, pressure relief, breathable fabric, and a restful sleep experience."
,,Mattress,Single Bed ,Monarda,"Single Bed memory foam mattress with ergonomic support, pressure relief, motion isolation, breathable fabric, durable construction, and a luxurious sleep experience."
,,Mattress,Single Bed ,Eucomis,"Single Bed   foam mattress with superior comfort, durable design, breathable fabric, orthopedic support, pressure relief, motion isolation, and a restful sleep experience.
"
,,Mattress,Single Bed ,Saxifraga,"Single Bed  cooling mattress with breathable fabric, advanced temperature regulation, pressure relief, motion isolation, ergonomic support, and a luxurious sleep experience."
,,Mattress,Single Bed ,Alyogyne,"Single Bed  hybrid mattress with memory foam and pocket springs, offering superior comfort, pressure relief, motion isolation, breathability, and ergonomic support for restful sleep."
,,Mattress,Single Bed ,Ageratum,"Single Bed   latex mattress with natural breathability, hypoallergenic properties, ergonomic support, pressure relief, motion isolation, and long-lasting durability for a restful sleep.
"
,,Mattress,Single Bed ,Nemastylis,"Single Bed   polyfoam mattress with durable support, pressure relief, breathable fabric, motion isolation, lightweight design, and enhanced comfort for a restful sleep.
"
,,Mattress,Single Bed ,Mitella,"Single Bed   coil and spring mattress with excellent support, motion isolation, breathable fabric, pressure relief, durable construction, and enhanced comfort for restful sleep.
"
,,Mattress,Double Bed,Penthorum,"Double-size hybrid mattress with a plush top layer, advanced support, pressure relief, and cooling features for enhanced comfort and restful sleep.
"
,,Mattress,Double Bed,Crocosmia,"Double-size mattress featuring a quilted top, robust coil support, breathable fabric, and a modern aesthetic for a truly restful sleep."
,,Mattress,Double Bed,Bauera,"Double Bed Premium Bonnell spring mattress offering superior comfort, durability, and support, with an elegant quilted design for a restful sleep."
,,Mattress,Double Bed,Arctotis,"Double Bed latex mattress with natural breathability, hypoallergenic properties, ergonomic support, pressure relief, motion isolation, and long-lasting durability for a restful sleep.
"
,,Mattress,Double Bed,Tylophora,"Double Bed polyfoam mattress with durable support, pressure relief, breathable fabric, motion isolation, lightweight design, and enhanced comfort for a restful sleep.
"
,,Mattress,Double Bed,Anthericum,"Double Bed foam mattress with superior comfort, durable design, breathable fabric, orthopedic support, pressure relief, motion isolation, and a restful sleep experience.
"
,,Mattress,Double Bed,Sandersonia,"Double Bed cooling mattress with breathable fabric, advanced temperature regulation, pressure relief, motion isolation, ergonomic support, and a luxurious sleep experience."
,,Mattress,Double Bed,Sparaxis,"Double Bed memory foam mattress with ergonomic support, pressure relief, motion isolation, breathable fabric, durable construction, and a luxurious sleep experience."
,,Mattress,Double Bed,Ajuga,"Double Bed mattress with premium comfort, durable construction, breathable fabric, orthopedic support, and a luxurious sleep experience for ultimate relaxation."
,,Mattress,Double Bed,Turnera,"Double Bed PU foam mattress offering superior comfort, durable design, excellent back support, pressure relief, breathable fabric, and a restful sleep experience."
,,Living,Bean Bag,Nestico,"Classic Cotton Printed Bean Bag – Ultra-Comfortable, Stylish Seating Filled with Premium Beans"
,,Living,Bean Bag,Zencush,Luxuriously Soft Furr Bean Bag – Pre-Filled with Premium Beans for Ultimate Comfort
